TERRACOTTA VILLA SAIGON,"292/17 điên biên phủ , p 17 , , Bình Thạnh, Hồ Chí Minh, Việt Nam, 72355","8,7",142,8.6,9.3,9.1,9.0,9.4,1,0,0,1,0,0,1,1,1,2.520.016,919.258
The Myst Dong Khoi,"6-8 Đường Hồ Huấn Nghiệp, Phường Bến Nghé, Quận 1, Hồ Chí Minh, Việt Nam, 700000","8,9",6459,9.4,9.2,8.6,8.8,9.1,1,1,0,0,1,1,1,1,0,8.827.398,5.113.126
Urban Hotel,"No. 50, Nguyen Xi Street, Ward 26, Bình Thạnh, Hồ Chí Minh, Việt Nam","8,4",39,8.8,9.5,9.3,8.7,8.8,1,0,0,0,0,0,1,1,1,699.513,593.934
S79 Sai Gon Hotel Bui Vien,"40/13 - 29 Bui Vien Street, District 1, Quận 1, Hồ Chí Minh, Việt Nam, 70000","8,0",425,8.5,8.4,8.1,7.3,7.9,0,1,0,0,1,0,1,1,1,Không có giá trước,Không có giá sau
AYA Homestay,"25/33 Nguyễn Bỉnh Khiêm, P.Bến Nghé, Q1, Quận 1, Hồ Chí Minh, Việt Nam, 700000","8,3",115,8.8,8.8,8.7,Không có,8.7,1,0,0,1,0,1,1,1,1,1.014.643,691.276
M Village Living Hồ Biểu Chánh,"7 Hồ Biểu Ch nh , Phú Nhuận, Hồ Chí Minh, Việt Nam, 700000","9,3",975,9.5,9.7,9.6,9.5,9.7,1,0,0,1,1,0,0,1,1,1.323.018,725.759
Novotel Living Nam Sài Gòn (Novotel Living Saigon South),"No 2 Street C Tan Phu Ward District 7, Quận 7, Hồ Chí Minh, Việt Nam, 700000","8,3",1835,8.4,8.7,Không có,Không có,8.7,1,1,0,0,0,1,0,1,0,4.322.849,1.780.000
Khách sạn Palago hướng công viên (Palago Park View Hotel),"287-289 Phạm Ngũ Lão, Quận 1, Hồ Chí Minh, Việt Nam, 700000","7,3",1629,8.3,7.3,7.2,6.5,7.0,1,1,0,0,1,0,1,1,1,1.596.739,681.050
Khách Sạn & Spa Roseland Sweet (Roseland Sweet Hotel & Spa),"4 Cao Bá Quát, Bến Nghé, Quận 1, Hồ Chí Minh, Quận 1, Hồ Chí Minh, Việt Nam, 70 000","9,0",2863,9.4,9.4,9.0,8.8,9.2,0,1,0,0,1,0,1,1,1,1.734.567,1.703.674
M Village Living Trần Quốc Thảo,"115/3 Tran Quoc Thao, Vo Thi Sau Ward, District 3, Quận 3, Hồ Chí Minh, Việt Nam, 700000","8,4",44,7.9,8.0,8.0,8.4,8.0,1,0,0,1,1,0,0,1,1,2.037.157,804.795
Vissai Saigon Hotel,"144 Nguyễn Văn Trỗi, Phú Nhuận District, Phú Nhuận, Hồ Chí Minh, Việt Nam","8,0",1074,7.9,8.3,8.0,7.8,8.5,0,0,0,0,0,1,1,1,1,2.985.963,1.639.759
Khách sạn Ruby Bến Thành (Ruby Hotel Ben Thanh),"185 -187 Lê Thánh Tôn Quận 1, Quận 1, Hồ Chí Minh, Việt Nam, 70000","8,5",824,9.2,8.7,8.7,7.9,8.7,1,1,0,0,1,0,1,1,1,1.000.000,865.803
Signature by M Village Lê Thánh Tôn,"24 Le Thanh Ton street, Ben Nghe ward, District 1, Quận 1, Hồ Chí Minh, Việt Nam, 7000","9,0",5429,9.5,9.5,9.1,Không có,9.4,1,1,0,1,1,1,1,1,0,5.783.078,2.807.824
Khách sạn Hoa Huỳnh (Hoa Huynh Hotel),"348 Đường Nguyễn Văn Linh, Bình Thuận, Quận 7, Thành phố Hồ Chí Minh, Việt Nam, Quận 7, Hồ Chí Minh, Việt Nam","6,6",32,7.0,7.2,6.9,7.1,6.8,1,0,0,0,1,0,1,1,1,Không có giá trước,Không có giá sau
phú gia bùi viện,"No. 21, 175 Pham Ngu Lao Street, Phu Gia, Bui Vien, phú gia bùi viện, Quận 1, Hồ Chí Minh, Việt Nam","7,5",1101,8.0,7.3,7.0,6.1,6.7,0,0,0,0,0,0,1,1,0,1.851.852,346.725
Sherwood Suites (Sherwood Suites ),"192 đường Nam Kỳ Khởi Nghĩa, Phường Võ Thị Sáu, Quận 3, Hồ Chí Minh, Việt Nam, 700000","9,3",2737,9.2,9.6,9.5,9.4,9.7,1,1,0,1,1,1,1,1,0,5.700.000,2.675.089
Halo Hotel,"23 Thủ Khoa Huân, Phường Bến Thành, Quận 1 , Quận 1, Hồ Chí Minh, Việt Nam, 71000","7,8",1948,9.0,7.9,7.9,Không có,Không có,1,1,0,0,1,0,1,1,1,Không có giá trước,Không có giá sau
"Căn hộ m² 1 phòng ngủ, 1 phòng tắm riêng ở Quận 4 (Sunny Apartment Ho Chi Minh)","51 Duong So 6, Khu Dan Cu Trung Son, Binh Chanh, 21, Bình Hưng, Hồ Chí Minh, Việt Nam, 700000","7,5",87,7.8,8.4,7.9,7.8,7.9,1,0,1,1,1,1,1,1,1,980.000,341.211
Khách Sạn Royal Sài Gòn (Royal Hotel Saigon),"133 Đại Lộ Nguyễn Huệ, Quận 1, Quận 1, Hồ Chí Minh, Việt Nam,","8,3",4510,9.2,8.3,8.0,7.7,8.1,1,1,1,0,1,1,1,1,1,6.285.850,1.742.504
Liberty Saigon Green View Hotel,"187 Phạm Ngũ Lão, Quận 1(Front of Taka Plaza_Dist 1), Quận 1, Hồ Chí Minh, Việt Nam, 70000","8,1",3550,8.8,8.2,8.0,7.5,8.2,1,1,0,0,1,0,1,1,1,2.052.010,917.108
Khách sạn Eden Star Sài Gòn (Eden Star Saigon Hotel),"38 Bùi Thị Xuân, Phường Bến Thành, Quận 1, Quận 1, Hồ Chí Minh, Việt Nam","8,4",7784,8.5,8.7,8.4,8.3,8.6,0,1,1,0,1,1,1,1,1,5.738.979,2.052.397
VINCITY - Vihomes Serviced Apartment,"Masteri Centre Point, Road N2, Long Thanh My, District 9, Ho Chi Minh 700000, Vietnam, Quận 9, Hồ Chí Minh, Việt Nam, 70000","8,1",18,7.4,8.3,8.9,8.9,8.6,1,0,1,1,1,1,1,1,1,1.113.088,602.908
Huazhu Hotel (华住酒店),"No. 302, Van Kiet Street, District 1, Ho Chi Minh City, Vietnam, Quận 1, Hồ Chí Minh, Việt Nam, 70000","7,8",1940,8.2,8.4,8.0,7.8,7.8,0,1,0,0,0,1,0,1,0,2.563.253,1.227.423
The MarQ Luxury by KVG Suite Apartment,"The Marq Luxury Building, Nguyen Dinh Chieu, Da Kao Ward, District 1, Ho Chi Minh City, Vietnam, Quận 1, Hồ Chí Minh, Việt Nam, 71000","2,0",1,Không có,Không có,2.0,Không có,Không có,1,0,0,0,1,0,1,1,1,Không có giá trước,Không có giá sau
Khách Sạn Dyn Opera (Dyn Opera Hotel),"18 Cao Ba Quat, Quận 1, Hồ Chí Minh, Việt Nam, 70000","7,4",1953,8.6,7.6,7.5,6.7,7.2,0,1,1,0,1,0,1,1,0,2.765.957,691.489
Bin Bin Hotel 8 - Near Sunrise City District 7,"16 Đường số 1, Quận 7, Hồ Chí Minh, Việt Nam, 72900","8,5",145,9.0,9.2,8.9,8.8,9.0,0,0,0,0,0,0,1,1,1,880.000,606.402
Express by M Village Thạch Thị Thanh,"No. 17, Thach Thi Thanh, Phuong Tan Dinh, Quận 1, Hồ Chí Minh, Việt Nam, 700000","8,8",293,8.9,9.4,9.1,8.9,9.3,1,0,0,1,1,0,0,1,0,1.927.866,889.206
M Village Living Nguyễn Văn Hưởng,"120 Nguyễn Văn Hưởng , Quận 2, Hồ Chí Minh, Việt Nam, 700000","8,8",280,8.8,9.4,9.1,8.7,9.3,1,0,0,1,1,0,0,1,1,1.787.465,1.125.635
Khách sạn NTA - Căn hộ dịch vụ (NTA Hotel - Serviced Apartments),"171-173 Điện Biên Phủ, Phường Đakao, Quận 1, TP.HCM, Quận 1, Hồ Chí Minh, Việt Nam, 700000","8,9",1184,8.9,9.4,9.1,8.8,9.5,1,0,0,1,1,1,1,1,1,2.604.184,1.413.807
Coucouhomestead II - Homestay quan 1,"Room 23, No. 135, Hem 135, Tran Hung Dao, Cau Ong Lanh Ward, Coucouhomestead II, Vietnam, coucouhomestead II, Quận 1, Hồ Chí Minh, Việt Nam, 700000","8,1",55,9.8,9.3,9.0,8.3,8.8,0,0,0,0,0,0,1,1,0,1.750.000,576.759
SAIGON COZY HOTEL,"241/22 Phạm Ngũ Lão, Quận 1, Hồ Chí Minh, Việt Nam, 700000","8,7",431,8.8,9.3,8.6,Không có,8.7,1,0,0,0,1,1,1,1,1,535.581,508.818
Khách sạn A25 - 167 Phạm Ngũ Lão (A25 Hotel - 167 Pham Ngu Lao),"167 Pham Ngu Lao, Pham Ngu Lao, Quan 1, Ho Chi Minh , Quận 1, Hồ Chí Minh, Việt Nam, 70000","8,2",675,9.0,8.5,8.3,7.8,8.2,0,1,0,0,1,0,1,1,1,1.887.766,677.698
Khách sạn A25 - 20 Bùi Thị Xuân (A25 Hotel - 20 Bui Thi Xuan),"20 Bui Thi Xuan, Ben Thanh, Quan 1, Ho Chi Minh, Quận 1, Hồ Chí Minh, Việt Nam, 700000","7,5",392,8.0,7.7,7.5,7.3,7.4,0,1,0,0,1,0,1,1,1,2.195.171,867.548
Cozrum Homes Yoga Corner,"283 Hoang Sa, Tan Dinh Ward, District 1, Hcmc, Quận 1, Hồ Chí Minh, Việt Nam, 700000","7,9",425,8.3,8.0,8.3,8.0,8.2,1,0,0,0,0,0,0,1,0,671.087,407.587
Khách sạn The Hammock Bến Thành (The Hammock Hotel Ben Thanh),"47-49 Lê Thị Riêng, Quận 1, Hồ Chí Minh, Việt Nam","9,0",2946,9.3,9.4,9.1,8.9,9.0,0,1,0,1,1,0,1,1,0,3.700.068,1.296.172
Saigon Rivergate Free City Walk Experience,"Room 151-155, Ben Van Don Street, Ward 6, RiverGate Apartment, Saigon, RiverGate Apartment Saigon, Quận 4, Hồ Chí Minh, Việt Nam, 754522","8,7",37,9.1,9.0,8.9,8.8,9.2,1,0,0,1,1,1,1,1,1,1.574.604,826.790
Saigonciti Hotel,"264 Đề Thám, phường Phạm Ngũ Lão, quận 1, TP Hồ Chí MInh, Quận 1, Hồ Chí Minh, Việt Nam","7,9",1173,8.8,8.3,7.8,7.2,7.8,1,1,0,1,1,0,1,1,1,818.300,471.855
Tuong Vi Corner Hotel,"740/15A-17 Sư Vạn Hạnh , Quận 10, Hồ Chí Minh, Việt Nam, 72510","8,7",322,9.0,9.3,8.8,8.7,9.1,1,1,0,1,0,1,1,1,1,3.500.000,919.643
Good For You Hotel,"92 Duong so 20 Phuong Binh An, Quan 2, TP.HCM, Quận 2, Hồ Chí Minh, Việt Nam, 700000","7,0",121,7.5,7.2,6.9,6.6,7.1,1,1,0,0,1,0,1,1,1,Không có giá trước,527.778
Bin Bin Hotel 11 - Near Island Diamond,"No. 58, 8 Đ, Thanh My Loi Ward, Bin Bin Hotel 11, Bin Bin Hotel 11, Quận 2, Hồ Chí Minh, Việt Nam, 720300","8,4",79,7.5,9.0,8.9,8.7,8.9,1,0,0,0,0,0,1,1,1,655.489,616.667
Khách sạn Aurora (Aurora Hotel),"No. 7A, 193A Nam Ky Khoi Nghia, Ward 7, Quận 3, Hồ Chí Minh, Việt Nam","8,2",238,8.8,8.8,8.4,7.8,8.3,0,0,0,0,1,0,1,1,1,377.703,367.920
Bin Bin Hotel 12 - Near Sala Residence,"128 Trương Văn Bang, Quận 2, Hồ Chí Minh, Việt Nam, 71300","8,4",53,8.7,8.6,8.8,8.3,8.9,0,0,0,0,0,0,1,1,1,629.343,502.453
Lam Son Serviced Apartment,"87 Đ. Lam Sơn, Phường 2, Lam Son Apartment, Tân Bình, Hồ Chí Minh, Việt Nam","8,2",158,8.5,8.1,8.4,7.8,7.8,1,0,0,0,1,0,1,1,1,Không có giá trước,Không có giá sau
A25 Hotel - 14 Ho Huan Nghiep,"No. 14, Ho Huan Nghiep, Ben Nghe, Quận 1, Hồ Chí Minh, Việt Nam, 700000","8,7",73,9.6,9.2,9.0,8.2,8.9,0,1,0,0,0,0,1,1,0,Không có giá trước,Không có giá sau
SKY STAR HOTEL,"No. 33, Street No. 21, Ward 8, Go Vap District, Ho Chi Minh City, Vietnam, Gò Vấp, Hồ Chí Minh, Việt Nam, 700000","8,3",221,8.7,9.0,8.5,8.6,8.8,1,0,1,0,1,0,1,1,1,1.311.130,382.713
LalaHouse Riverside Residence,"No. 51, Nguyen Ngoc Phuong, Ward 19, Bình Thạnh, Hồ Chí Minh, Việt Nam, 70000","9,0",253,9.1,9.4,9.4,9.1,9.3,1,1,0,0,0,0,1,1,1,566.068,402.476
MK Studio,"319, Lien Phuong Street, Phu Huu Ward, Thu Duc City, HCMC, Quận 9, Hồ Chí Minh, Việt Nam, 70000","8,8",109,8.5,9.2,9.3,9.0,9.2,0,1,0,0,0,0,0,1,1,660.000,396.726
White Lotus - Boutique,"76e Phạm Viết Chánh, White Lotus - Boutique Hotel, Bình Thạnh, Hồ Chí Minh, Việt Nam","8,9",189,8.8,9.5,8.9,8.5,9.4,1,1,0,0,1,0,1,1,0,1.386.999,876.871
Khách sạn Lotus Laverne (Lotus Laverne Hotel),"5/24 No Trang Long Street, Binh Thanh District, Bình Thạnh, Hồ Chí Minh, Việt Nam, 0000","7,3",728,7.0,7.9,7.0,6.8,7.1,1,1,0,0,0,0,0,1,1,831.644,342.545
Somi Luxstay LP,"Nguyen Huu Canh, Landmark 81 LP, Bình Thạnh, Hồ Chí Minh, Việt Nam, 700000","9,4",266,9.6,9.3,9.3,9.3,9.3,1,1,0,1,1,0,1,1,1,2.195.867,1.384.460
CÁT ANH HOTEL,"69 Đường Số 8, Cát Anh Hotel, Gò Vấp, Hồ Chí Minh, Việt Nam, 70000","7,4",150,7.1,7.1,7.3,7.1,7.5,0,0,0,0,0,0,1,1,1,745.061,638.889
Netflix Studio Near Ben Thanh Market,"240/9A, Le Thanh Ton Street, Ben Thanh Ward, District 1, Haha House, Quận 1, Hồ Chí Minh, Việt Nam, 10000","8,5",516,8.7,7.9,8.4,7.6,8.5,1,0,1,0,0,0,1,1,1,2.140.529,490.741
Bui Vien Street Hostel,"28/23-25 Bùi Viện, 28/23-25 Bùi Viện, Quận 1, Hồ Chí Minh, Việt Nam, 700000","8,8",581,9.2,9.1,8.5,8.5,8.7,1,0,0,0,1,0,1,1,0,Không có giá trước,Không có giá sau
Phong Lan 2 Hotel,"24A, Quang Trung, Phường Hiệp Phú, TP Thủ Đức, TPHCM, Quận 9, Hồ Chí Minh, Việt Nam, 700000","7,8",107,8.0,8.2,7.9,7.7,7.9,0,0,0,0,0,0,1,1,1,811.390,279.503
Golden Uc Chau House and Spa,"No. 719, Le Hong Phong Street, Ward 12, Quan 10, Quan 10, Quận 10, Hồ Chí Minh, Việt Nam","8,4",67,9.0,9.0,8.5,8.5,8.7,1,0,0,0,0,1,1,1,1,632.645,353.393
Saigonciti Hotel,"264 Đề Thám, phường Phạm Ngũ Lão, quận 1, TP Hồ Chí MInh, Quận 1, Hồ Chí Minh, Việt Nam","7,9",1173,8.8,8.3,7.8,7.2,7.8,1,1,0,1,1,0,1,1,1,818.300,471.855
Locasis Hotel and Service Apartment,"7 Ngô Văn Năm, Oriental Art Hotel & Apartment Dist. 1 HCMC, Quận 1, Hồ Chí Minh, Việt Nam","8,0",24,9.3,8.3,8.3,7.3,8.3,1,0,0,0,1,0,1,1,0,Không có giá trước,1.143.791
La Maison en Adagio | Sleep and Heal,"42/4A Trần Đ nh Xu, phường C Giang, Quận 1 , Quận 1, Hồ Chí Minh, Việt Nam, 70000","8,7",158,8.1,9.5,8.4,8.3,8.5,0,1,0,0,1,0,1,1,1,Không có giá trước,Không có giá sau
Khách sạn Phương Thùy (Phuong Thuy Hotel Thu Duc near QL13),"4 đường số 17, phường Hiệp Bình Phước, Thủ Đức, TP. HCM, Thủ Đức, Hồ Chí Minh, Việt Nam, 00000","7,6",226,7.9,8.2,7.8,7.4,7.6,1,1,0,0,0,0,1,1,1,472.765,299.963
Sabina Boutique Hotel 3,"2-4 Phan Khiem Ich street, Hung Gia 1 Town, Tan Phong Ward, District 7, Quận 7, Hồ Chí Minh, Việt Nam, 72900","8,8",289,Không có,9.1,8.8,8.5,9.0,0,1,0,0,1,0,1,1,1,Không có giá trước,1.355.653
Khách sạn HANZ Sơn Mi Sài Gòn (HANZ Son Mi Hotel Saigon),"839/10 Le Hong Phong, District 10, Quận 10, Hồ Chí Minh, Việt Nam, 700000","8,9",900,9.2,9.1,9.1,9.0,9.1,1,0,0,0,1,1,1,1,1,Không có giá trước,Không có giá sau
THANH TAI HOTEL 2,"15A Phan Van Hon Street, Tan Thoi Nhat Ward, District 12, Ho Chi Minh City, Vietnam, Quận 12, Hồ Chí Minh, Việt Nam, 700000","8,6",326,8.7,9.0,8.9,8.6,8.8,0,1,0,0,0,0,1,1,1,1.711.970,305.195
Nhà trọ & Café The Like (The Like Hostel & Cafe),"150/37 Nguyen Trai, Quận 1, Hồ Chí Minh, Việt Nam","8,8",32,9.5,9.8,9.3,8.7,9.1,1,1,0,0,0,0,1,1,0,Không có giá trước,Không có giá sau
Trang An Hotel,"627 X&#244; Viết Nghệ Tĩnh, Phường 26, Quận B&#236;nh Thạnh, Ho Chi Minh city, Bình Thạnh, Hồ Chí Minh, Việt Nam, 72310","8,3",206,8.7,8.9,8.5,8.2,8.6,0,0,0,0,0,0,1,1,0,541.899,435.987
LalaHouse Summer Park,"49L Phan Đăng Lưu, Phu Nhuận, TP. HCM, Bình Thạnh, Hồ Chí Minh, Việt Nam, 70000","8,0",171,8.6,8.4,8.3,Không có,8.2,1,0,1,0,1,0,1,1,1,750.000,484.615
The Rice 131 Bui Vien Hotel,"125-127-129-131 đường B i Viện, phường Phạm Ngũ L o, Quận 1, tp Hồ Ch Minh, Quận 1, Hồ Chí Minh, Việt Nam, 008428","7,7",87,7.9,7.7,7.1,7.2,8.2,0,1,0,0,1,0,1,1,0,716.771,579.856
Saigon City Center,"385/143 Nguyễn Công Trứ, P. Cầu Ông Lãnh, Quận 1, Quận 1, Hồ Chí Minh, Việt Nam, 70000","6,5",875,6.8,6.3,6.7,5.8,6.2,0,0,0,0,0,0,1,1,1,337.492,163.025
THE LUMIÈRE RIVERSIDE LUXURY SUITE,"No. 259, Vo Nguyen Giap Street, District 2, Thu Duc, Ho Chi Minh City, Quận 2, Hồ Chí Minh, Việt Nam, 71100","8,1",84,7.9,7.1,7.0,7.7,7.5,1,1,1,1,1,1,1,1,1,5.803.818,1.450.954
SOHO Central Residence & Apartment District 1,"100 Cô Giang, Phường Cô Giang, Quận 1, Hồ Chí Minh, Việt Nam, 71013","8,8",294,6.5,6.2,5.8,6.4,6.7,1,0,0,0,1,0,1,1,1,2.563.673,1.281.428
BEAUTIFUL SAIGON HOTEL,"40/27 Đ. B&#249;i Viện, Quận 1, Hồ Chí Minh, Việt Nam, 70000","7,0",327,7.6,6.9,5.9,6.2,6.8,0,0,0,0,1,0,1,1,1,990.000,346.325
Truong Giang Hotel,"55-57-59 Triệu Quang Phục, Phường 10 Quận 5, Quận 5, Hồ Chí Minh, Việt Nam, 7000","7,8",370,7.9,8.3,8.1,7.5,7.9,0,0,0,0,0,0,1,1,1,1.322.751,319.150
BIG HOTEL SÀI GÒN,"No. 35-37, Street No. 4, Trung Son Urban Area, Binh Hung Commune, Binh Chanh District, Ho Chi Minh City, Bình Hưng, Hồ Chí Minh, Việt Nam, 71803","8,9",551,8.3,8.0,8.0,7.6,7.9,1,0,0,0,1,0,1,1,1,767.914,311.147
Soho View Residence Luxury Apartment,"No. 100 Cô Giang, Phường Cô Giang, SOHO, Quận 1, Hồ Chí Minh, Việt Nam, 70000","8,1",63,8.4,9.3,8.6,9.3,8.4,0,0,0,0,0,1,1,1,0,Không có giá trước,Không có giá sau
Hoàng Quân Hotel - Gò Vấp,"No. 26, Nguyen Van Luong, Ward 6, Go Vap, Ho Chi Minh City, Vietnam, Gò Vấp, Hồ Chí Minh, Việt Nam","7,2",55,7.5,7.7,7.9,7.4,7.6,0,0,0,0,0,0,1,1,1,269.907,248.760
Mother's Home,"72 Nguyen Khoai, Ward 2, District 4, Quận 4, Hồ Chí Minh, Việt Nam, 700000","8,7",148,8.8,9.4,9.2,9.0,9.4,1,0,0,1,0,0,1,1,1,1.500.000,685.134
Khách sạn A25 - 251 Hai Bà Trưng HCM (A25 Hotel - 251 Hai Bà Trưng HCM),"251 Hai Ba Trung, Vo Thi Sau, Quan 3, Ho Chi Minh , Quận 3, Hồ Chí Minh, Việt Nam, 7000","7,7",216,8.5,7.6,7.7,7.5,7.7,1,1,0,0,1,0,1,1,1,1.275.799,1.012.528
"VIHOMES MASTERI - Complex ""Centre Point, Lumiere Boulevard"" - Free pool, gym, Yoga room","Masteri Centre Point, N2 Street, Long Thanh My, District 9, Ho Chi Minh 700000, Vietnam, Quận 9, Hồ Chí Minh, Việt Nam, 70000","8,0",9,8.6,8.6,8.6,9.4,9.4,1,0,1,1,1,1,1,1,1,1.443.368,810.993
Căn hộ dịch vụ Phú Mỹ Hưng - Saigon South - Gần Vivo City Mall (Phu My Hung - Saigon South Serviced Apartments - Near Vivo City Mall),"R4 - 35 Hưng Phước 4, Phường Tan Phong, Quận 7, Quận 7, Hồ Chí Minh, Việt Nam, 70000","9,1",763,9.2,9.4,9.4,Không có,9.3,1,0,1,0,1,0,1,1,1,1.127.326,488.237
Vuong Tron homestay,"191/34 Cống quỳnh Phường nguyễn cư trinh quận 1, Quận 1, Hồ Chí Minh, Việt Nam, 700000","7,0",347,7.7,7.5,7.2,7.0,7.2,1,0,0,0,0,0,1,1,1,358.959,259.259
Somi Luxstay Landmark 81,"208 Nguyen Huu Canh, Landmark 81, Bình Thạnh, Hồ Chí Minh, Việt Nam, 700000","8,7",274,9.6,9.3,Không có,9.4,9.5,1,0,0,0,1,0,1,1,1,1.819.816,1.721.799
"Chung cư 40 m² 1 phòng ngủ, 1 phòng tắm riêng ở Quận Tân Bình (TEDDY APARTMENT | Luxury 5* 1BR apt near Airport!)","5B Pho Quang Phuong 2, Tan Binh, Tân Bình, Hồ Chí Minh, Việt Nam","8,1",262,8.7,8.3,8.3,8.0,8.7,1,0,1,0,0,1,0,1,1,Không có giá trước,694.444
Urban Hotel,"No. 50, Nguyen Xi Street, Ward 26, Bình Thạnh, Hồ Chí Minh, Việt Nam","8,4",39,8.8,9.5,9.3,Không có,8.8,1,0,0,0,0,0,1,1,1,699.513,593.934
Biệt thự Serenity Sài Gòn Sky – Dịch Vụ Đưa Đón Sân Bay Một Chiều Miễn Phí (Serenity Saigon Sky Villas - Free 1-way Airport Shuttle),"259 Điện Biên Phủ , Quận 3, Hồ Chí Minh, Việt Nam, 70000","8,6",185,9.3,9.0,Không có,9.3,9.0,1,1,1,1,1,1,1,1,1,21.388.889,4.268.731
MoonStay,"29/8 Yên Thế, Tân Bình, Hồ Chí Minh, Việt Nam","7,7",263,8.4,8.1,Không có,7.9,7.6,1,0,0,0,0,0,0,1,1,500.000,383.585
VINCITY - Vihomes Serviced Apartment,"Masteri Centre Point, Road N2, Long Thanh My, District 9, Ho Chi Minh 700000, Vietnam, Quận 9, Hồ Chí Minh, Việt Nam, 70000","8,1",18,Không có,8.3,8.9,8.9,8.6,1,0,1,1,1,1,1,1,1,1.113.088,602.908
Song Hung 1 Luxury Hotel & Apartments,"R4, 66-67, Đường Hưng Phước 2, Phú Mỹ Hưng, phường Tân Phong, Quận 7, Hồ Chí Minh, Việt Nam, 700000","8,2",96,8.8,8.6,8.5,Không có,8.3,0,0,0,0,1,0,1,1,1,1.200.000,575.443
MDHOTEL 2,"105/16 Nguyen Thi Tu Street, Binh Hung Hoa B Ward, Binh Tan District, Ho Chi Minh City, V, Bình Tân, Hồ Chí Minh, Việt Nam, 71900","7,3",376,7.9,8.0,8.1,7.5,7.8,0,0,0,0,0,0,1,1,1,314.531,277.778
Nhà An Phúc Đoàn Như Hài (An Phuc House Doan Nhu Hai),"15/1B Doan Nhu Hai, District 4, Ho Chi Minh city, Vietnam, Quận 4, Hồ Chí Minh, Việt Nam","8,0",366,8.4,8.3,8.3,7.8,8.0,0,1,0,0,0,0,0,1,1,Không có giá trước,416.667
Celavie Services Apartments Vinhomes & Landmark 81,"Room 720A, Dien Bien Phu St, Vinhomes Tan Cang, Bình Thạnh, Hồ Chí Minh, Việt Nam, 72300","8,3",154,8.9,8.2,8.3,8.3,8.3,1,0,0,1,1,0,0,1,1,1.798.588,1.138.861
White Lotus - Boutique,"76e Phạm Viết Chánh, White Lotus - Boutique Hotel, Bình Thạnh, Hồ Chí Minh, Việt Nam","8,9",189,8.8,9.5,8.9,8.5,9.4,1,1,0,0,1,0,1,1,0,1.386.999,876.871
Khách Sạn Silverland Sakyo (Silverland Sakyo Hotel),"10A Lê Thánh Tôn, Quân 1, Quận 1, Hồ Chí Minh, Việt Nam, 70000","8,7",4657,9.1,9.1,Không có,Không có,8.9,1,1,0,0,1,1,1,1,0,4.961.334,2.490.564
SUNFLOWER CBQ HOTEL,"11B THÁI VĂN LUNG, PHƯỜNG BẾN NGHÉ, QUẬN 1, TP. HCM, Quận 1, Hồ Chí Minh, Việt Nam","8,2",536,9.0,8.5,8.2,7.8,8.4,0,1,0,0,1,0,1,1,0,Không có giá trước,Không có giá sau
Saigon City Residence Serviced Apartment,"8A/3D2 Thái Văn Lung, Quận 1, Hồ Chí Minh, Việt Nam","8,5",366,9.1,8.8,Không có,Không có,8.5,1,0,0,1,0,1,1,1,0,1.844.944,1.261.569
Khách sạn A25 - 307 Lý Tự Trọng (A25 Hotel - 307 Lý Tự Trọng),"307 - 309 Ly Tu Trong, Ben Thanh, Quan 1, Ho Chi Minh , Quận 1, Hồ Chí Minh, Việt Nam, 70000","8,4",437,8.9,8.5,8.4,Không có,8.3,0,1,0,0,1,0,1,1,1,1.125.105,754.343
The Reverie Saigon,"22 - 36 Nguyễn Huệ, Phường Bến Nghé, Quận 1, Thành phố Hồ Chí Minh, Quận 1, Hồ Chí Minh, Việt Nam, 700000","9,4",2449,9.7,Không có,Không có,9.5,9.7,1,1,0,0,1,1,1,1,1,10.110.707,6.301.329
Khách sạn A25 - 35 Mạc Thị Bưởi (A25 Hotel- 35 Mac Thi Buoi),"35 Mac Thi Buoi, Ben Nghe, Quan 1, Ho Chi Minh, Quận 1, Hồ Chí Minh, Việt Nam, 7000","7,7",661,8.7,7.7,7.8,Không có,7.4,0,1,0,0,1,0,1,1,1,2.118.164,752.248
The Royal LandPark - Phu My Hung,"25 Hưng Gia 3 , Ward Tan Phong, Quận 7, Hồ Chí Minh, Việt Nam, 70000","8,4",291,8.8,9.0,8.5,Không có,8.4,0,1,1,0,1,0,1,1,1,1.259.722,697.129
Ruby Studio Apartment - City Center,"135/53 Tran Hung Dao Street, Cau Ong Lanh Ward, Quận 1, Hồ Chí Minh, Việt Nam, 700000","8,6",100,9.0,8.8,8.9,Không có,8.8,0,0,0,0,0,0,0,1,0,3.183.812,493.937
Khách sạn Na Nue (Na Nue Hotel),"No. 8, 185, Pham Ngu Lao, Phuong Pham Ngu Lao, District 1, Ho Chi Minh City, Vietnam, Quận 1, Hồ Chí Minh, Việt Nam","7,9",386,8.9,8.3,8.0,Không có,7.6,0,0,0,0,1,0,1,1,0,740.916,538.680
Lucy House,"219/14 Trần Văn Đang, Phường 11, Quận 3, Hồ Chí Minh, Việt Nam, 70000","8,0",166,8.2,8.3,8.1,Không có,8.3,1,1,0,1,1,0,1,1,1,845.069,409.178
M Village Hotel Hai Bà Trưng,"No. 180A Hai Ba Trung, Da Kao Ward, District 1, Ho Chi Minh City, M Village, M Village, Quận 1, Hồ Chí Minh, Việt Nam, 700000","8,9",354,9.0,9.5,9.2,Không có,9.4,1,0,0,1,1,0,1,1,1,3.163.193,1.468.711
LUM Apartment Saigonroyal,"9 Nguyen Truong To, Phuong 12, Saigonroyal Residence, Saigonroyal Residence , Quận 4, Hồ Chí Minh, Việt Nam, 70000","8,3",197,6.0,6.0,6.0,6.0,6.0,1,0,0,1,1,0,1,1,1,Không có giá trước,Không có giá sau
Khách sạn A25 29 Bùi Thị Xuân (A25 Hotel - 29 Bui Thi Xuan),"29 - 31 Bui Thi Xuan, Ben Thanh, District 1, Ho Chi Minh , Quận 1, Hồ Chí Minh, Việt Nam, 7000","8,0",1193,8.6,8.3,8.2,Không có,8.1,0,1,0,0,1,0,1,1,1,1.365.921,911.036
7Apartment,"20/9 Nguyễn Trường Tộ, Phường 12, Quận 4, Hồ Chí Minh, Việt Nam","8,9",158,8.8,9.4,8.9,8.8,8.8,1,0,0,0,0,0,0,1,0,Không có giá trước,648.148
Diamond Boutique Hotel,"36 Hưng Gia 3, Tân Phong, Quận 7, Hồ Chí Minh, Việt Nam, 700000","7,8",150,8.6,7.9,7.9,7.7,Không có,1,0,0,0,1,0,1,1,1,1.647.864,1.645.926
Tracy Ben Thanh Tower,"172 Đường Ký Con, 40, Quận 1, Hồ Chí Minh, Việt Nam, 700000","8,6",458,8.8,6.9,7.1,Không có,7.1,1,0,1,0,1,1,0,1,1,Không có giá trước,1.875.000
Galaxy Boutique Hotel,"269/19 Đề Thám, Galaxy Boutique Hotel, Quận 1, Hồ Chí Minh, Việt Nam","8,2",1891,9.2,8.8,8.4,Không có,8.2,1,1,0,1,1,0,1,1,1,3.060.393,377.240
Căn hộ dịch vụ Phú Mỹ Hưng - Saigon South - Gần Vivo City Mall (Phu My Hung - Saigon South Serviced Apartments - Near Vivo City Mall),"R4 - 35 Hưng Phước 4, Phường Tan Phong, Quận 7, Quận 7, Hồ Chí Minh, Việt Nam, 70000","9,1",763,9.2,9.4,9.4,Không có,9.3,1,0,1,0,1,0,1,1,1,1.127.326,488.237
Khách sạn A25 - 251 Hai Bà Trưng HCM (A25 Hotel - 251 Hai Bà Trưng HCM),"251 Hai Ba Trung, Vo Thi Sau, Quan 3, Ho Chi Minh , Quận 3, Hồ Chí Minh, Việt Nam, 7000","7,7",216,8.5,7.6,7.7,Không có,7.7,1,1,0,0,1,0,1,1,1,1.275.799,1.012.528
Khách Sạn Park Hill Nam Sài Gòn (Park Hill Hotel Saigon South),"67 Lê Văn Thiêm, Khu Phố Hưng Phước 3, Quận 7, Hồ Chí Minh, Việt Nam, 72915","8,2",900,8.7,8.6,8.3,Không có,8.2,1,1,0,1,1,0,1,1,1,641.624,491.332
Khách Sạn Sao Nam - Phố Đi Bộ Bùi Viện (Sao Nam Hotel - Bui Vien Walking Street),"175/5 Pham Ngu Lao Street, District 1, HCMC, Viet Nam., Quận 1, Hồ Chí Minh, Việt Nam, 70000","7,9",273,9.0,8.5,8.0,Không có,7.6,0,0,0,0,0,0,1,1,1,543.497,376.779
Luxhome,"84/37 Bùi Viện, Phường Phạm Ngũ Lão, Quận 1, Quận 1, Hồ Chí Minh, Việt Nam, 700000","9,5",14,9.4,9.1,9.1,8.6,9.1,0,0,0,0,0,0,1,1,1,Không có giá trước,Không có giá sau
Khách Sạn Des Arts Saigon - MGallery Collection (Hôtel des Arts Saigon - MGallery Collection),"76 - 78 Nguyễn Thị Minh Khai, Quận 3, Quận 3, Hồ Chí Minh, Việt Nam, 70000","9,1",2219,9.1,9.2,Không có,9.0,9.4,1,1,0,0,1,1,1,1,1,6.648.254,3.996.000
Mother's Home,"72 Nguyen Khoai, Ward 2, District 4, Quận 4, Hồ Chí Minh, Việt Nam, 700000","8,7",148,8.8,9.4,9.2,9.0,9.4,1,0,0,1,0,0,1,1,1,1.500.000,685.134
Home Away Serviced Apartment - Ky Con,"No. 2, 54, Ky Con Street, Nguyen Thai Binh Ward, Vietnam, Quận 1, Hồ Chí Minh, Việt Nam, 71010","9,0",249,9.1,9.6,9.3,Không có,9.1,1,0,0,0,1,0,0,1,0,1.674.248,640.067
Mia Hotel,"155 Đ. Calmette, Phường Nguyễn Thái Bình, Quận 1, Hồ Chí Minh, Việt Nam","9,2",455,9.4,9.7,9.2,Không có,9.4,1,0,1,0,0,1,1,1,0,Không có giá trước,916.667
Khách sạn A25 14 Phó Đức Chính (A25 Hotel - 14 Pho Duc Chinh),"14 Pho Duc Chinh, Nguyen Thai Binh, Quan 1, Ho Chi Minh, Quận 1, Hồ Chí Minh, Việt Nam, 700000","7,5",561,7.7,7.8,7.7,Không có,Không có,0,1,0,0,1,0,1,1,1,Không có giá trước,Không có giá sau
Saigon Hotel & Apartment,"150/7 Đường Nguyễn Trãi, 150/7/3 Nguyễn Trãi. Phường Bến Thành, Quận 1, TP. Hồ Chí Minh, Vietnam, Quận 1, Hồ Chí Minh, Việt Nam, 70000","8,7",106,9.2,9.3,9.1,8.8,9.3,0,0,0,0,1,0,1,1,1,Không có giá trước,729.514
Khách sạn Kin Lý Tự Trọng (Kin Hotel Ly Tu Trong),"145-147 Lý Tự Trọng, Phường Bến Thành, Quận 1 , Quận 1, Hồ Chí Minh, Việt Nam, 7000000","8,8",68,9.2,9.7,9.2,Không có,9.5,1,1,0,0,1,0,1,1,1,Không có giá trước,1.303.514
Sunny Serviced Apartment,"56 Lê Thánh Tôn, Quận 1, Hồ Chí Minh, Hồ Chí Minh, Việt Nam,, Quận 1, Hồ Chí Minh, Việt Nam","8,9",1079,9.3,9.1,9.0,Không có,9.0,1,0,0,1,1,0,1,1,1,Không có giá trước,Không có giá sau
Infinity Pool Signature - With Pool&Netflix 2 (Infinity Pool Signature - Saigon Riverside),"151 Ben Van Don, Quận 4, Hồ Chí Minh, Việt Nam, 700000","9,5",955,9.8,9.8,Không có,9.7,9.7,1,0,0,1,1,1,0,1,0,1.750.931,783.929
