MICASA HOTEL,"No. 5, 27-29, Street 6B, Trung Son Residential Area, Binh Hung, Binh Chanh, Ho Chi Minh City, Vietnam, 5, Bình Hưng, Hồ Chí Minh, Việt Nam, 70000","7,7",224,8.2,8.3,8.1,8.0,8.2,0,0,0,0,0,0,1,1,1,684.516,601.852
Hotel Continental Saigon,"132-134 Đồng Khởi, Quận 1, Quận 1, Hồ Chí Minh, Việt Nam,","8,4",7353,9.5,8.4,8.3,Không có,8.4,1,1,0,0,1,1,1,1,1,6.412.139,1.801.747
Landmark 81 & Vinhomes Central Park - Vacation Apartment,"Vinhome Central Park HCMC - 720A Dien Bien Phu , Bình Thạnh, Hồ Chí Minh, Việt Nam, 72300","8,9",112,9.4,8.8,9.0,9.2,9.0,1,0,1,1,0,0,0,1,0,3.398.430,1.504.254
Khách sạn Giang Linh (Giang Linh Hotel),"311 Ly Tu Trong Street,' 'Ben Thanh Ward, District 1, Quận 1, Hồ Chí Minh, Việt Nam, 700000","7,7",882,8.7,7.9,7.9,6.9,7.3,0,0,0,0,0,0,1,1,0,1.932.467,372.251
Khách sạn Đại Nam Sài Gòn (Dai Nam Sai Gon Hotel),"5/11 Nguyen Sieu Street, Ben Nghe Ward, District 1, Quận 1, Hồ Chí Minh, Việt Nam, 700000","8,2",1660,9.0,8.3,8.6,Không có,8.3,0,0,0,0,0,0,1,1,1,1.122.101,601.624
Golden Star Apartment & Hotel,"454 Phạm Thái Bường, Quận 7, Hồ Chí Minh, Việt Nam","9,1",680,9.2,9.3,9.4,9.1,9.5,1,0,1,0,0,0,1,1,1,1.014.275,668.293
Tago Hotel - Suong Nguyet Anh,"No. 91, Suong Nguyet Anh Street, Phuong Pham Ngu Lao, Quận 1, Hồ Chí Minh, Việt Nam, 700000","8,5",231,9.1,9.1,9.0,8.4,9.0,0,0,0,0,1,0,1,1,1,Không có giá trước,Không có giá sau
M Village Hotel Tao Đàn Park,"No. 14, Truong Dinh, Vo Thi Sau Ward, District 3, Quận 3, Hồ Chí Minh, Việt Nam, 700000","9,2",959,9.3,9.7,9.2,Không có,9.4,1,0,0,1,1,1,1,1,1,Không có giá trước,1.200.600
Golden Hotel & Apartment,"R4-06 Hung Gia 5, Tan Phong Ward, Quận 7, Hồ Chí Minh, Việt Nam, 70000","8,5",138,9.0,9.3,8.8,8.4,8.7,0,0,0,1,0,0,0,1,1,Không có giá trước,Không có giá sau
L'anmien,"22 Trương Quyền, Quận 3, Hồ Chí Minh, Việt Nam, 722000","8,2",291,8.6,8.6,8.4,8.4,8.3,1,0,0,1,0,0,0,1,1,753.618,666.667
Khách Sạn Âu Lạc Legend (Au Lac Legend Hotel),"90 Nguyễn Thị Minh Khai, quận 3, Quận 3, Hồ Chí Minh, Việt Nam, 72407","8,8",4745,9.0,9.0,Không có,8.6,9.0,1,1,1,0,1,1,1,1,1,3.000.000,1.398.210
Nguyệt Hà Hotel,"39 Phan Xich Long, Phuong 2, Nguyet Ha Hotel, Nguyệt Hà Hotel, Phú Nhuận, Hồ Chí Minh, Việt Nam, 72210","5,6",42,7.1,6.5,4.8,4.8,4.8,0,0,0,0,1,0,1,1,1,580.000,370.370
M Village Living Kỳ Đồng,"No. 20/9, Ky Dong Street, Ward 9, M Village, M Village, Quận 3, Hồ Chí Minh, Việt Nam, 700000","9,0",349,8.9,9.3,9.2,8.9,9.5,1,0,0,1,1,0,0,1,1,1.835.188,973.220
Lucky Star Hotel Q5,"60/3 Nguyen Trai Street, Ward 3, District 5, Ho Chi Minh City, Quận 5, Hồ Chí Minh, Việt Nam, 700000","7,3",276,7.8,7.8,7.2,6.8,7.3,1,0,0,0,1,0,1,1,1,2.865.753,442.139
Cozrum Homes Greena House,"74/5 Thach Thi Thanh, Tan Dinh Ward, District 1, Quận 1, Hồ Chí Minh, Việt Nam, 700000","6,9",405,7.5,7.5,7.5,7.5,Không có,1,0,0,0,0,0,0,1,0,704.705,349.913
Trung Mai Hotel,"785 Nguyen Trai, Q.5, Quận 5, Hồ Chí Minh, Việt Nam","7,4",317,7.9,7.6,7.6,Không có,7.4,0,1,0,0,0,0,1,1,1,499.480,422.421
Glenwood City Resort,"243 Nguyễn Văn Hưởng, P. Thảo Điền, Quận 2, Hồ Chí Minh, Việt Nam, 70000","8,2",1676,8.1,8.7,8.4,Không có,8.7,0,1,0,0,1,1,1,1,1,1.649.988,1.099.421
Khách sạn Cactusland Boutique (Cactusland Boutique Hotel),"28 Rach Bung Binh, Ward 8, District 3, Quận 3, Hồ Chí Minh, Việt Nam, 00000","7,8",686,8.4,8.3,7.7,7.4,7.7,0,0,0,0,0,0,0,1,0,1.017.026,477.165
The Malibu Hotel Saigon,"No. 353, Street 1, Binh Tri Dong B Ward, Binh Tan District, Phường Bình Trị Đông B, Quận Bình Tân, Bình Tân, Hồ Chí Minh, Việt Nam, 70000","8,8",84,8.7,9.1,9.0,8.9,9.4,0,0,0,0,0,0,1,1,1,Không có giá trước,Không có giá sau
Hạnh Trang Hotel,"113 Xuân Hồng, Tân Bình, Hồ Chí Minh, Việt Nam","8,1",467,8.3,8.7,8.6,8.1,8.6,1,0,0,0,1,0,1,1,1,641.002,365.655
Hung Huong Hotel,"321 đường Nguyễn Thái Bình, phường 12, quận Tân Bình, Tân Bình, Hồ Chí Minh, Việt Nam, 70000","7,3",164,7.8,7.4,7.6,7.1,7.3,0,0,0,0,0,0,1,1,1,Không có giá trước,272.877
Rachel Serviced Apartment,"No. 95, Phan Khiem Ich Street, Quận 7, Hồ Chí Minh, Việt Nam, 700000","8,1",365,8.8,8.5,8.4,7.9,8.3,0,0,0,0,0,0,0,1,0,1.500.000,512.457
Wah Fu Hotel,"No. 90, Hung Vuong, Ward 9, Quận 5, Hồ Chí Minh, Việt Nam, 72760","8,0",392,8.7,8.4,8.3,7.9,8.6,0,0,0,0,0,0,1,1,1,1.760.029,1.277.077
Căn hộ Cherry - Trung tâm Thảo Điền (Cherry apartment - Thao Dien Centre),"9/5 Đường số 10, Quận 2, Hồ Chí Minh, Việt Nam, 700000","8,5",505,8.7,8.9,8.8,8.6,8.8,1,0,0,1,0,0,1,1,1,800.000,491.992
KHÁCH SẠN & SPA MINH TÂM PHÚ NHUẬN (MINH TAM PHU NHUAN HOTEL & SPA),"145/8 Nguyễn Văn Trỗi, Phường 11, Quận Phú Nhuận, Phú Nhuận, Hồ Chí Minh, Việt Nam, 700000","8,1",781,8.1,8.4,8.3,8.0,8.2,0,1,0,1,1,0,1,1,1,1.500.000,508.480
Ciao Saigon 2 Hotel,"30 Đống Đa, Tân Bình, Hồ Chí Minh, Việt Nam, 72519","7,9",606,8.5,8.4,8.0,7.8,8.2,1,1,0,0,1,1,1,1,1,2.000.000,748.033
Khách sạn & Căn hộ KunKin Luxury (KunKin Luxury Hotel & Apartment ),"46/24 Nguyễn Cửu Vân, Bình Thạnh, Hồ Chí Minh, Việt Nam, 70000","8,1",315,Không có,8.6,8.1,8.0,8.5,1,0,0,0,0,1,1,1,1,Không có giá trước,815.903
Signature Boutique Hotel,"80/1 Đường Nguyễn Trãi, Phường 3, Quận 5, Hồ Chí Minh, Việt Nam, 70000","7,9",1544,7.7,8.4,8.1,7.4,8.1,0,1,0,0,1,0,1,1,0,1.850.000,682.992
8h-hostel,"155/11 Cống Quỳnh Street, 155/11 Cống Quỳnh Street, 155/11 Đường Cônvs Quỳnh, Quận 1, Hồ Chí Minh, Việt Nam, 71014","8,1",183,8.6,8.7,8.4,7.6,7.8,1,0,0,1,0,0,1,1,0,Không có giá trước,Không có giá sau
Khách sạn Grand Sài Gòn (Hotel Grand Saigon),"08 Đồng Khởi, Phường Bến Nghé, Quận 1, Thành phố Hồ Chí Minh , Quận 1, Hồ Chí Minh, Việt Nam, +84 28","8,6",6920,9.3,8.7,Không có,8.4,8.9,1,1,0,0,1,1,1,1,1,Không có giá trước,5.306.136
Luong Huu Khanh Homestay - Centre District 1,"No. 23, Luong Huu Khanh, Phuong Pham Ngu Lao, Vietnam, Quận 1, Hồ Chí Minh, Việt Nam, 70000","8,6",226,8.9,8.8,9.0,8.6,8.7,1,0,0,0,0,0,1,1,1,739.632,525.131
Nu Hotel,"No. 18, Bui Vien Street, Quận 1, Hồ Chí Minh, Việt Nam, 700000","7,8",641,8.8,8.2,8.0,7.3,8.0,0,0,0,0,0,0,1,1,0,1.000.000,438.579
La Serena Hotel & Apartment,"18 Hưng Phước 4 , Quận 7, Hồ Chí Minh, Việt Nam, 70000","8,5",657,8.8,8.5,8.5,8.1,8.2,1,0,0,1,0,0,1,1,1,739.754,538.463
Khách sạn La Memoria - Trung tâm thành phố (La Memoria Hotel - City Centre),"118 Nguyen Cu Trinh street, Nguyen Cu Trinh Ward, District 1, Quận 1, Hồ Chí Minh, Việt Nam, 700000","8,8",1232,9.2,9.3,9.0,8.6,8.8,0,0,0,0,0,0,1,1,1,1.110.822,731.534
Avanti Boutique,"208 - 210 Le Thanh Ton, Quận 1, Hồ Chí Minh, Việt Nam","8,0",1390,9.1,8.0,8.0,7.2,8.0,0,1,0,0,0,0,1,1,0,3.656.616,897.494
Tháp Yours Studio (Yours Studio Tower),"39A Tran Khac Chan, Phú Nhuận, Hồ Chí Minh, Việt Nam, 700000","8,3",303,8.4,8.8,8.5,8.4,8.6,1,1,0,1,1,0,1,1,1,2.000.000,592.744
"Kin Wander Tan Binh, The Mountain","No. 51, Nui Thanh Street, Ward 13, Tân Bình, Hồ Chí Minh, Việt Nam, 70000","8,9",132,9.1,9.5,9.2,9.2,9.4,1,1,0,1,0,0,1,1,1,3.000.000,922.847
Silk Hong Ha hotel,"43-45 Hồng Hà, Tân Bình, Hồ Chí Minh, Việt Nam, 70000","8,5",688,8.9,8.7,8.7,8.3,8.8,1,0,0,0,1,1,1,1,1,1.050.000,686.574
Anpha Boutique Hotel,"202 Lê Thanh Tôn, Quận 1, Hồ Chí Minh, Việt Nam, 70000","8,4",890,9.2,8.5,8.0,7.4,8.5,1,1,0,0,1,1,1,1,1,4.021.164,809.073
Nhà trọ Sakura Sài Gòn (Sakura Hostel Saigon),"39/26, Nguyễn Trãi, P. Bến Thành, Quận 1, Hồ Chí Minh, Việt Nam, 70000","7,5",1167,8.2,7.8,7.6,6.8,7.1,0,0,0,0,1,0,1,1,0,319.010,300.670
THE RICE HOTEL,"No. 9, Floor 40, Bui Vien Street, Phuong Pham Ngũ Lao, Vietnam, Quận 1, Hồ Chí Minh, Việt Nam","8,7",779,8.9,9.1,8.6,Không có,8.7,1,1,0,0,0,0,1,1,0,1.500.000,652.958
Eden Garden Hotel,"28/12 Bui Vien Street, Pham Ngu Lao Ward , Quận 1, Hồ Chí Minh, Việt Nam","7,6",3961,8.4,7.7,7.7,Không có,7.5,0,1,0,0,1,0,1,1,1,2.000.000,734.099
MAY'S HOTEL-BEN THANH MARKET,"22 Nguyễn An Ninh, MAY'S HOTEL-BEN THANH MARKET , Quận 1, Hồ Chí Minh, Việt Nam, 700000","7,6",706,9.1,8.0,7.9,7.0,7.4,1,0,0,0,1,0,1,1,0,1.960.000,661.376
Bình Triệu Hotel - Gò Vấp,"No. 8, Lane 234, Le Duc Tho, Ward 6, Go Vap District, Ho Chi Minh City, Gò Vấp, Hồ Chí Minh, Việt Nam, 700000","8,7",110,9.2,9.2,9.4,8.8,9.2,0,0,0,0,0,0,1,1,1,1.433.704,355.640
Halo Hotel,"23 Thủ Khoa Huân, Phường Bến Thành, Quận 1 , Quận 1, Hồ Chí Minh, Việt Nam, 71000","7,8",1948,9.0,7.9,7.9,Không có,Không có,1,1,0,0,1,0,1,1,1,3.000.000,698.413
GIC Apartment and Hotel,"2/11 Hong Ha, Tân Bình, Hồ Chí Minh, Việt Nam, 700000","7,1",709,8.2,7.3,7.3,6.5,6.8,0,0,0,0,1,0,1,1,1,730.896,411.260
LANGUAGE EXCHANGE HOTEL 3,"212B, C6/7 Nguyen Trai , W. Nguyen Cu Trinh, Quận 1, Hồ Chí Minh, Việt Nam, 00000","6,6",455,6.6,6.9,6.4,6.1,6.0,1,0,0,1,1,0,1,1,1,359.371,295.864
Khách Sạn Cường Thanh 2 (Khach San Cuong Thanh 2),"107 Trần Thiện Chánh, Phường 12, Quận 10, Quận 10, Hồ Chí Minh, Việt Nam","7,6",16,8.3,7.1,6.5,6.8,7.2,0,0,0,0,0,1,1,1,1,Không có giá trước,Không có giá sau
The Sophia Apartment - Thao Dien Central,"No. 14, D5 Street, Carik Residential Area, An Khanh Ward, Thu Duc City, Ho Chi Minh City, Quận 2, Hồ Chí Minh, Việt Nam, 700000","9,2",431,Không có,9.4,9.4,9.1,9.5,1,0,0,0,0,0,1,1,1,3.084.667,454.917
Yen Nam Hotel Nguyen Thai Son,"84/1, Street 1, Ward 4, Go Vap District, HCM City., Gò Vấp, Hồ Chí Minh, Việt Nam, 700000","8,6",670,8.8,9.1,9.0,8.9,9.1,1,0,0,0,0,0,1,1,0,Không có giá trước,Không có giá sau
Cozrum Homes - Coraline House,"No. 41A, Hòa Hưng, Ward 13, District 10, Ho Chi Minh City, Vietnam, Quận 10, Hồ Chí Minh, Việt Nam, 0840001","7,7",701,8.3,7.9,7.9,7.9,7.7,1,0,0,1,0,0,0,1,1,Không có giá trước,319.025
Cozrum Homes - Summer's House,"Room 1A, No. 50, Street 3/2, Ward 12, District 10, Ho Chi Minh City, Quận 10, Hồ Chí Minh, Việt Nam, 08400001","7,2",807,7.9,7.7,7.8,7.5,7.4,1,0,0,0,0,1,0,1,0,389.682,377.232
Khách sạn & Căn hộ DHTS Business (DHTS Business Hotel & Apartment),"38/16 Nguyen Van Troi, Phuong 15, Quan Phu Nhuan, Phú Nhuận, Hồ Chí Minh, Việt Nam, 70000","9,2",582,8.9,9.6,9.2,9.2,9.5,1,0,1,0,1,1,1,1,1,1.891.800,1.486.326
Khách sạn Ánh Thiên (Anh Thien Hotel),"No. 35E, Nguyen Trung Truc Street, Quận 1, Hồ Chí Minh, Việt Nam, '700000'","8,1",402,8.8,8.8,8.2,7.5,7.7,0,0,0,0,1,0,1,1,1,1.182.523,443.674
Khách sạn A25 29 Bùi Thị Xuân (A25 Hotel - 29 Bui Thi Xuan),"29 - 31 Bui Thi Xuan, Ben Thanh, District 1, Ho Chi Minh , Quận 1, Hồ Chí Minh, Việt Nam, 7000","8,0",1193,8.6,8.3,8.2,7.7,8.1,0,1,0,0,1,0,1,1,1,1.365.921,911.036
Yen Nam Hotel Hoang Van Thu,"197A Hoang Van Thu, Ward 8, Phu Nhuan District, Ho Chi Minh City, Phú Nhuận, Hồ Chí Minh, Việt Nam, 700000","8,3",481,8.8,8.8,8.6,8.3,8.7,0,0,0,0,0,0,1,1,0,666.452,425.471
Cozrum Homes - June Corner,"68/7D Trần Quang Khải, Quận 1, Hồ Chí Minh, Việt Nam, 0840001","7,4",708,7.9,7.7,7.8,7.5,7.7,1,0,0,1,0,0,0,1,0,688.857,345.046
DORI HOUSE Quận 1,"47 Đỗ Quang Đẩu DORI COFFEE, Quận 1, Hồ Chí Minh, Việt Nam, 9000000","8,5",105,8.9,8.8,8.8,8.3,8.7,1,0,0,1,0,0,0,1,1,Không có giá trước,Không có giá sau
Khách sạn & Căn hộ Golden Sun (Golden Sun Apartment & Hotel),"153 STREET NUMBER 10, TAN PHONG WARD, DISTRICT 7, HCMC, Quận 7, Hồ Chí Minh, Việt Nam, 70000","9,3",293,9.3,9.3,9.4,Không có,9.5,1,0,1,0,0,0,1,1,1,1.770.805,987.911
The Shilla Luxury I Hotel,"No. 75, Pham Khiem Ich, Phu My Hung Urban Area, Tan Phong Ward, District 7, Vietnam, Quận 7, Hồ Chí Minh, Việt Nam, 70000","8,1",304,8.6,8.3,8.1,Không có,8.1,1,0,0,0,1,0,1,1,1,851.399,451.226
Ben Thanh Inn - M&A,"44/1 Nam Ky Khoi Nghia, Nguyen Thai Binh Ward, District 1, Ho Chi Minh City, Quận 1, Hồ Chí Minh, Việt Nam, 700000","8,5",196,9.1,9.0,8.8,8.3,8.5,0,0,0,0,0,0,1,1,1,606.925,397.203
Cozrum Homes Charming Corner,"453/16 Nguyen Dinh Chieu, Ward 5, District 3, Hcmc, Quận 3, Hồ Chí Minh, Việt Nam, 700000","7,4",593,8.1,7.9,7.7,7.6,7.7,1,0,0,0,0,0,0,1,0,897.669,245.381
The Royal Sky - Phu My Hung,"73 Đường số 2 Khu phố Hưng Gia 2, Phường T n Phong, Quận 7, Quận 7, Hồ Chí Minh, Việt Nam, 700000","9,1",50,9.3,9.7,9.4,8.9,9.5,0,1,0,0,1,1,1,1,1,2.504.905,777.574
Khách Sạn C’Lavie – Saigon Airport Hotel (C’Lavie Hotel – Saigon Airport Hotel),"548A Cách Mạng Tháng 8, Phường 11, Quận 03, TPHCM, Quận 3, Hồ Chí Minh, Việt Nam, 700000","8,6",258,8.9,9.0,8.8,8.5,8.8,1,1,0,0,0,0,1,1,1,636.340,523.913
Căn hộ dịch vụ INDO (INDO Serviced Apartment),"8A/6C2 Thai Van Lung, Quận 1, Hồ Chí Minh, Việt Nam","8,6",940,9.2,9.4,8.8,8.1,8.0,1,1,0,1,1,1,1,1,1,1.089.702,1.068.796
Sunshine Residences By 5H,"13 Song Day, Phuong 2, Quan Tan Binh, Tân Bình, Hồ Chí Minh, Việt Nam, 700000","8,4",852,8.9,8.7,8.7,8.6,8.8,1,0,0,1,0,1,1,1,0,920.221,595.364
Khách sạn The One Premium (The One Premium Hotel),"29 Thủ Khoa Huân, Phường Bến Thành, Quận 1, Quận 1, Hồ Chí Minh, Việt Nam, 700000","6,9",532,8.3,7.5,6.7,6.0,6.5,0,1,0,0,1,1,1,1,0,562.527,539.520
MADISON SAIGON Centerpoint,"15 Thi Sach, Ben Nghe Ward, District 1, Quận 1, Hồ Chí Minh, Việt Nam, 70000","9,2",404,9.6,9.5,9.4,9.5,9.5,1,0,1,1,1,0,0,1,1,Không có giá trước,Không có giá sau
Landmark 81 & Vinhomes Central Park - Vacation Apartment,"Vinhome Central Park HCMC - 720A Dien Bien Phu , Bình Thạnh, Hồ Chí Minh, Việt Nam, 72300","8,9",112,9.4,Không có,9.0,9.2,9.0,1,0,1,1,0,0,0,1,0,3.398.430,1.504.254
Bland Landmark Luxury Residence by Bevista,"208 Nguyễn Hữu Cảnh, Bình Thạnh, Hồ Chí Minh, Việt Nam, 700000","8,1",1255,8.5,7.7,7.9,7.8,7.7,1,1,1,0,1,1,1,1,1,3.678.475,1.653.175
Asian Ruby Boutique Hotel,"20 Bis Đường Bùi Thị Xuân, Phường Bến Thành, Quận 1, Hồ Chí Minh, Việt Nam, 70000","8,0",1363,8.3,8.2,8.2,7.5,8.0,0,1,0,0,1,0,1,1,1,1.949.571,465.514
Khách Sạn Calmette (Calmette Hotel),"151, Calmette, Phường Nguyễn Thái Bình, Quận 1, Ho-Chi-Minh, Quận 1, Hồ Chí Minh, Việt Nam, 700000","8,2",930,9.0,8.7,8.2,Không có,7.9,1,0,0,0,0,0,1,1,1,912.833,521.213
Sen Boutique House,"51 Đường số 2 Khu Báo chí, Phường Thảo Điền, Quận 2, Hồ Chí Minh, Việt Nam, 70000","8,6",648,8.5,9.0,9.0,8.6,9.0,1,0,0,1,1,0,1,1,0,1.001.881,825.514
LUNA Luxury Residence - Vinhomes Landmark,"No. 720A, Dien Bien Phu Street, Bình Thạnh, Hồ Chí Minh, Việt Nam","8,5",185,8.5,8.0,8.5,8.8,8.8,0,0,0,0,0,0,1,1,1,1.456.763,658.148
saigonairport hotel,"No.9 Nguyen Van Mai Str, Tan Binh Dist, HCMC, Vietnam, Tân Bình, Hồ Chí Minh, Việt Nam, 72100","8,0",142,8.5,8.1,8.1,7.7,8.0,0,1,1,0,1,1,1,1,1,1.172.337,527.245
Song Nhat Hotel,"20/19 Núi Thành, Phường 13, Quận Tân Bình, Tân Bình, Hồ Chí Minh, Việt Nam, 70000","9,0",370,9.1,9.4,9.4,9.0,9.3,0,0,0,0,0,0,0,1,1,321.896,278.945
RUBY STAR HOTEL,"43 Trương Định, Quận 3, Hồ Chí Minh, Việt Nam, 700000","7,7",525,8.6,8.2,8.1,7.7,7.9,0,0,0,0,0,0,1,1,1,844.814,446.168
Coco Inn Saigon,"Số 24d, hẻm 24, Bui Đinh Tuy, Phường 26, Quận Binh Thạnh, TP Hồ Chi Minh, Bình Thạnh, Hồ Chí Minh, Việt Nam, 72310","7,7",45,7.9,7.8,7.9,7.7,7.5,1,0,0,0,0,0,1,1,1,Không có giá trước,Không có giá sau
Vissai Saigon Hotel,"144 Nguyễn Văn Trỗi, Phú Nhuận District, Phú Nhuận, Hồ Chí Minh, Việt Nam","8,0",1074,7.9,8.3,8.0,7.8,8.5,0,0,0,0,0,1,1,1,1,2.985.963,1.639.759
Nexus House Cây Điệp,"No. 161, Cay Diep Street, Da Kao, Quận 1, Hồ Chí Minh, Việt Nam, 700000","8,6",128,8.6,9.1,8.8,8.1,8.2,1,0,0,0,0,0,1,1,0,1.663.287,865.088
Happyland Hotel,"102-104 Lý Tự Trọng, Happyland Hotel, Quận 1, Hồ Chí Minh, Việt Nam, 70000","7,5",525,9.0,7.9,7.7,6.7,7.1,1,1,0,0,1,0,1,1,1,938.284,479.950
Khách sạn Lan Anh (Lan Anh Hotel),"252 Đề Thám, phường Phạm Ngũ Lão, Quận 1, Quận 1, Hồ Chí Minh, Việt Nam, 70000","7,7",1413,8.6,7.8,7.8,6.8,7.4,0,1,0,0,1,0,1,1,1,652.363,495.888
Gemini Saigon LUXURY,"40 Bùi Viện, Quận 1, Hồ Chí Minh, Việt Nam, 700000","7,4",1723,8.0,7.5,7.2,6.5,7.5,1,1,0,0,1,0,1,1,1,2.171.389,740.741
Meraki 198 Bùi Viện (Meraki 198 Bui Vien),"198 Bùi Viện, Quận 1, Tp. Hồ Chí Minh, Quận 1, Hồ Chí Minh, Việt Nam, 70000","7,4",2114,8.2,7.9,7.6,Không có,Không có,1,1,0,0,1,1,1,1,1,567.656,141.914
Acnos grand Hotel,"82 Đường Cách Mạng Tháng 8, Quận 3, Hồ Chí Minh, Việt Nam, 700000","8,3",534,8.6,8.8,8.5,8.5,8.8,1,1,0,0,1,1,1,1,0,Không có giá trước,1.416.667
Royal Apartment Landmark,"Room 720A, Dien Bien Phu St, Vinhomes Tan Cang, Bình Thạnh, Hồ Chí Minh, Việt Nam, 72300","8,7",109,9.4,9.1,9.2,9.3,9.2,1,1,0,0,1,0,0,1,1,2.175.288,1.754.198
Căn hộ River Gate - Best View River (Best View River - River Gate Apartment),"151 Bến Vân Đồn, Quận 4, Hồ Chí Minh, Việt Nam","8,5",320,9.2,9.0,8.8,8.9,8.7,1,0,0,1,0,1,0,1,0,Không có giá trước,Không có giá sau
The LUMIERE Riverside Residence,"259 Vo Nguyen Giap, An Phu Ward, Quận 2, Hồ Chí Minh, Việt Nam, 70000","9,1",253,9.5,9.4,9.5,9.5,9.5,1,0,1,1,1,1,0,1,1,3.354.813,1.661.516
Cozrum Homes Lý Chính Thắng (Cozrum Homes Ly Chinh Thang),"7/7 Ly Chinh Thang, Ward 8, District 3, Hcmc, Quận 3, Hồ Chí Minh, Việt Nam, 700000","7,7",858,8.3,7.8,7.9,Không có,7.7,1,0,0,0,1,0,0,1,0,621.816,353.770
La Casa di Dicembre HCMC,"2 Trường Sa, Phường 17, Bình Thạnh, Hồ Chí Minh, Việt Nam","9,0",270,9.2,9.8,9.6,9.3,9.5,1,0,0,0,0,0,1,1,1,Không có giá trước,Không có giá sau
Phu Gia Hotel,"193 Nguyễn Thái Học, Quận 1, Hồ Chí Minh, Việt Nam","7,4",1062,8.6,8.1,7.3,6.5,6.8,0,0,0,0,0,0,1,1,1,1.597.919,399.480
Little Saigon Boutique Hotel,"36 Bis/ 2 đường Lê Lợi, phường Bến Nghé, quận 01, Quận 1, Hồ Chí Minh, Việt Nam, 70000","8,5",2470,9.1,8.9,8.4,7.6,8.6,1,1,0,0,1,1,1,1,1,Không có giá trước,998.673
Khách sạn Kỳ Hòa Sài gòn (Ky Hoa Hotel Saigon),"238 Đường Ba Thang Hai, Phường 12, Quận 10, Quận 10, Hồ Chí Minh, Việt Nam, 70000","7,4",449,8.3,7.3,7.4,7.0,7.5,1,1,0,0,1,1,1,1,1,873.408,839.375
"Chung cư 40 m² 1 phòng ngủ, 1 phòng tắm riêng ở Quận Tân Bình (TEDDY APARTMENT | Luxury 5* 1BR apt near Airport!)","5B Pho Quang Phuong 2, Tan Binh, Tân Bình, Hồ Chí Minh, Việt Nam","8,1",261,8.7,8.3,8.3,8.0,8.7,1,0,1,0,0,1,0,1,1,Không có giá trước,694.444
Mia Sài Gòn - Khách Sạn Luxury Boutique (Mia Saigon - luxury boutique hotel),"2-4, đường số 10, khu phố 4, phường An Phú, Quận 2, Quận 2, Hồ Chí Minh, Việt Nam, 700000","9,1",2882,Không có,9.6,9.3,9.3,9.7,1,1,0,0,1,1,1,1,1,10.878.607,4.738.410
The Shilla Luxury I Hotel,"No. 75, Pham Khiem Ich, Phu My Hung Urban Area, Tan Phong Ward, District 7, Vietnam, Quận 7, Hồ Chí Minh, Việt Nam, 70000","8,1",304,8.6,8.3,8.1,7.5,8.1,1,0,0,0,1,0,1,1,1,851.399,451.226
Scenic Valley Việt Nam - Vina We Stay (Scenic Valley VietNam - Vina We Stay),"Block F, Scenic Valley 1, 808 Nguyen Van Linh, P. Tan Phu, Quận 7, TP.Hồ Chi Minh, Quận 7, Hồ Chí Minh, Việt Nam, 700000","7,2",173,7.8,7.3,7.3,7.3,6.9,1,0,1,1,1,1,0,1,1,Không có giá trước,Không có giá sau
MINT HOTEL Q.1,"20 Đỗ Quang Đẩu, MINT HOTEL, Quận 1, Hồ Chí Minh, Việt Nam, 700000","7,9",604,8.5,8.8,8.0,7.6,8.1,1,0,0,0,0,1,1,1,1,Không có giá trước,Không có giá sau
Khách sạn The One Premium (The One Premium Hotel),"29 Thủ Khoa Huân, Phường Bến Thành, Quận 1, Quận 1, Hồ Chí Minh, Việt Nam, 700000","6,9",532,8.3,7.5,6.7,Không có,6.5,0,1,0,0,1,1,1,1,0,562.527,539.520
Justay Pink Church,"22 Lý Chính Thắng, 8, Quận 3, Hồ Chí Minh, Việt Nam, 700000","8,1",657,8.6,8.7,8.3,7.9,8.5,1,0,0,0,1,0,1,1,0,1.268.261,566.670
Cozrum Homes Lý Chính Thắng (Cozrum Homes Ly Chinh Thang),"7/7 Ly Chinh Thang, Ward 8, District 3, Hcmc, Quận 3, Hồ Chí Minh, Việt Nam, 700000","7,7",858,8.3,7.8,7.9,7.6,7.7,1,0,0,0,1,0,0,1,0,621.816,353.770
Khách sạn Minh Hoàng (Minh Hoang Hotel),"74 Binh Gia, Ward 13, Tan BInh Dist, Tân Bình, Hồ Chí Minh, Việt Nam, 70000","8,2",761,8.2,8.8,8.5,7.9,8.4,1,0,0,0,1,0,1,1,1,596.785,370.016
Mai Phuong - Ruby Sai Gon Hotel,"No. 213, Dong Den, Ward 11, Tan Binh District, Ho Chi Minh City 24, Vietnam, 24, Tân Bình, Hồ Chí Minh, Việt Nam, 74000","8,2",235,8.7,9.0,8.5,7.9,8.3,1,0,0,0,1,0,1,1,1,577.723,334.870
Zen Thao Dien,"63b Nguyễn Cừ, Quận 2, Hồ Chí Minh, Việt Nam","8,2",124,8.9,7.6,8.4,7.5,7.9,1,0,0,0,0,0,0,1,0,Không có giá trước,744.167
Phước Tài Hotel,"No. 20, Núi Thành Road, Phường 13, Tân Bình District, Vietnam, 74/20 Núi Thành, Tân Bình, Hồ Chí Minh, Việt Nam, 70000","7,6",159,8.0,8.4,8.0,7.4,7.6,0,0,0,0,0,0,1,1,1,Không có giá trước,Không có giá sau
Maison Royale,"129/4 Ly Chinh Thang Street, Ward 7, Dist 3,, Quận 3, Hồ Chí Minh, Việt Nam","9,0",716,9.2,9.7,9.1,8.9,9.3,1,0,0,0,0,0,0,1,1,Không có giá trước,481.481
Tony Apartment,"100 Cô Giang, Phường Cô Giang, Quận 1, Hồ Chí Minh, Việt Nam, 700000","9,4",21,9.8,9.3,9.8,8.8,9.8,1,0,0,1,0,0,0,1,0,Không có giá trước,Không có giá sau
Khách sạn Silverland Sil (Silverland Sil Hotel),"20–22 Thai Van Lung, Quận 1, Hồ Chí Minh, Việt Nam, 700000","9,0",642,9.3,9.5,9.0,Không có,9.2,0,1,0,0,1,1,1,1,0,3.895.936,1.888.095
saigonairport hotel,"No.9 Nguyen Van Mai Str, Tan Binh Dist, HCMC, Vietnam, Tân Bình, Hồ Chí Minh, Việt Nam, 72100","8,0",142,8.5,8.1,8.1,7.7,8.0,0,1,1,0,1,1,1,1,1,1.172.337,527.245
Liberty Central Saigon Citypoint Hotel,"59-61 Đường Pasteur, Quận 1, Quận 1, Hồ Chí Minh, Việt Nam, 70000","8,8",7904,9.4,9.0,Không có,Không có,9.1,1,1,1,0,1,1,1,1,1,17.640.741,3.504.862
Bonita Grand Hotel,"570-572 Trần Hưng Đạo, phường 2, Quận 5, Thành phố Hồ Chí Minh, Quận 5, Hồ Chí Minh, Việt Nam, 70000","7,3",606,7.7,7.4,7.3,6.9,7.1,0,0,0,0,0,0,1,1,0,353.998,342.688
Holiday Inn & Suites Saigon Airport By IHG,"18E Cong Hoa Street, Tan Binh , Tân Bình, Hồ Chí Minh, Việt Nam, 70000","8,9",2077,Không có,9.2,9.0,9.1,9.4,1,1,1,0,1,1,1,1,1,3.786.847,2.443.462
Spring Light Apartment,"Số 2, Đường 16, KDC Ven Sông, P Tân Phong, Q7, TPHCM, Quận 7, Hồ Chí Minh, Việt Nam, 700000","8,0",82,Không có,8.7,8.4,8.1,8.6,1,0,1,1,0,1,1,1,1,656.717,534.871
President Maison Signature By M Village,"33 Tu Xuong, Ward 7, District 3, Ho Chi Minh City, Quận 3, Hồ Chí Minh, Việt Nam, 700000","9,5",293,9.4,9.9,9.4,9.5,9.8,1,1,0,0,1,1,1,1,1,6.534.462,2.951.774
Crescent Residence 1,"103 Ton Dat Tien, Tan Phu,, Quận 7, Hồ Chí Minh, Việt Nam, 70000","9,0",1087,9.2,9.2,8.9,9.1,9.3,1,0,1,1,0,1,1,1,1,3.700.000,2.061.780
Collection O VyVy Airport Hotel,"283, Hoang Van Thu, Quan Tan Binh, Ho Chi Minh, Viet Nam, Ho-Chi-Minh, Tân Bình, Hồ Chí Minh, Việt Nam, 00084","6,8",257,7.3,6.6,6.2,6.0,5.8,0,0,0,1,0,0,1,1,1,788.903,402.341
Marki House,"39 Đường Thanh Loan, Quận 8, Hồ Chí Minh, Việt Nam, 70000","9,2",1270,8.8,9.4,9.5,9.1,9.6,1,0,0,1,0,0,0,1,0,Không có giá trước,Không có giá sau
Amango Home Tran Hung Dao,"Room 391, TK39, No. 23 Trần Hưng Đạo, Cầu Kho, Vietnam, Quận 1, Hồ Chí Minh, Việt Nam, 700000","8,4",587,7.6,7.6,7.9,7.4,8.0,1,0,0,0,1,0,1,1,1,628.845,567.729
GOLDEN SUN Hotel Apartments,"No. 72, Phan Khiem Ich Street, Tan Phong Ward, Vietnam, Quận 7, Hồ Chí Minh, Việt Nam, 756600","7,6",261,8.1,7.8,7.6,7.4,7.3,1,0,0,0,0,0,1,1,1,Không có giá trước,561.000
Khách sạn Ngân Hà (Ngan Ha Hotel),"406, Tran Phu, Quận 5, Hồ Chí Minh, Việt Nam, 70000","7,4",460,8.1,7.7,7.3,7.0,7.3,0,0,0,0,1,0,1,1,1,810.000,342.593
Căn hộ dịch vụ Mayfair Suites (Mayfair Suites Serviced Apartment),"102ABC Cong Quynh Street, Pham Ngu Lao Ward, District 1 , Quận 1, Hồ Chí Minh, Việt Nam, 700000","8,7",1644,9.0,9.1,8.9,8.3,9.1,1,0,0,1,0,0,1,1,1,1.206.568,818.574
Common Inn Thảo Điền (Common Inn Thao Dien),"19, Đường số 38, Phường Thảo Điền, Quận 2, Thành phố Hồ Chí Minh, Việt Nam, Quận 2, Hồ Chí Minh, Việt Nam, 700000","8,7",1452,9.1,9.1,8.8,Không có,9.0,1,1,0,1,0,0,1,1,1,Không có giá trước,747.486
Khách sạn Happy Life (Happy Life Hotel),"542A-544 Huỳnh Tấn Phát & số 2 Nguyễn Thị Thập, Quận 7, Thành Phố Hồ Chí Minh, Quận 7, Hồ Chí Minh, Việt Nam, 70000","7,5",793,7.2,7.7,7.9,7.2,7.6,1,1,0,0,1,0,1,1,1,1.396.153,751.657
Khách sạn Căn hộ HT (HT Hotel Apartment),"128/1 Trần Quốc Thảo - Phường Võ Thị Sáu - Quận 3 - TP. Hồ Chí Minh, Quận 3, Hồ Chí Minh, Việt Nam, 740000","8,8",341,8.8,9.3,9.0,8.6,8.8,1,0,0,0,0,0,1,1,0,Không có giá trước,509.259
Khách sạn Novotel Sài Gòn Centre (Novotel Saigon Centre Hotel),"167 Đường Hai Bà Trưng, Quận 3, Quận 1, Hồ Chí Minh, Việt Nam, 700000","8,4",3863,8.5,8.6,Không có,Không có,8.9,1,1,0,0,1,1,1,1,1,6.324.907,3.120.000
SOFEA Boutique Hotel,"19 Trương Định, Phường Bến Thành, Quận 1, Hồ Chí Minh, Việt Nam","8,2",19,9.3,8.8,8.3,8.0,8.4,0,0,0,0,1,0,1,1,0,674.118,656.607
New Sunny1,"38 Khu Phố Hưng Phước 3, Quận 7, Hồ Chí Minh, Việt Nam, 70000","7,7",153,8.5,8.3,8.1,7.5,7.7,0,0,0,0,1,0,1,1,1,Không có giá trước,Không có giá sau
